{
  "schemaVersion": "1.0",
  "kind": "loopengineer.channelState",
  "channel_id": "channel-contract",
  "channel_type": "contract",
  "state": "channel-granted",
  "version": {
    "productVersion": "0.1.0",
    "protocolVersion": "1",
    "schemaVersion": "1.0",
    "skillContractVersion": "1"
  },
  "updated_at": "2026-06-15T09:30:00Z",
  "owner": {
    "scheduler_id": "scheduler-19",
    "unit_id": "unit-channel-schema",
    "pr": "#69",
    "head_sha": "1234567890abcdef"
  },
  "owned_paths": [
    "schemas/v1/channel-state.schema.json",
    "schemas/v1/watcher-decision.schema.json"
  ],
  "release_predicate": "PR validation passes and watcher decision is recorded.",
  "waiting_scheduler_ids": [
    "scheduler-20"
  ],
  "next_action": {
    "owner": "scheduler",
    "action": "complete granted contract changes then report release evidence",
    "status": "required"
  }
}
